{
  "$schema": "https://json-schema.org/draft/2020-12/schema",
  "$id": "https://schemas.voyagerai.dev/phase4/WeatherResult.schema.json",
  "title": "WeatherResult",
  "description": "The 'result' payload shape when ProviderResponseEnvelope.capability='weather' (Checkpoint Phase 4 C.0, docs/adr/0009-phase4-checkpointc0-live-data-and-react-design.md). Explicitly distinguishes a forecast, a current observation, historical data, and an unavailable result via 'kind' -- a caller must never infer freshness from field presence alone. freshness/provenance/retrieved_at live on the enclosing ProviderResponseEnvelope, not duplicated here. schema_version 1.1.0 (Checkpoint Phase 4 C.1, docs/adr/0010-phase4-checkpointc1-openmeteo-weather-adapter.md) additively introduces optional 'requested_location', 'country', 'resolved_latitude', 'resolved_longitude', and 'attribution' -- needed once a real geocoding-backed adapter (Open-Meteo) exists to resolve a free-text location and to carry the provider's own attribution/licence notice. Every existing 1.0.0 instance (none of these fields set) remains valid unchanged.",
  "type": "object",
  "properties": {
    "schema_version": { "enum": ["1.0.0", "1.1.0"] },
    "location": { "type": "string", "minLength": 1 },
    "requested_location": {
      "type": "string",
      "minLength": 1,
      "description": "1.1.0+ only. The original, unmodified location string the caller supplied -- preserved even when 'location' below reflects a geocoded/resolved name that differs from it."
    },
    "country": {
      "type": "string",
      "minLength": 1,
      "description": "1.1.0+ only. The resolved country name or code, present only when a geocoding step actually supplied one."
    },
    "resolved_latitude": { "type": "number", "minimum": -90, "maximum": 90 },
    "resolved_longitude": { "type": "number", "minimum": -180, "maximum": 180 },
    "attribution": {
      "type": "object",
      "description": "1.1.0+ only. Present whenever the provider's own terms require attribution -- e.g. Open-Meteo's CC BY 4.0 licence notice. Never fabricated when a provider has no such requirement.",
      "properties": {
        "license": { "type": "string", "minLength": 1 },
        "notice": { "type": "string", "minLength": 1 }
      },
      "required": ["license", "notice"],
      "additionalProperties": false
    },
    "timezone": {
      "type": "string",
      "pattern": "^(UTC|[A-Za-z_]+/[A-Za-z_]+(/[A-Za-z_]+)?)$",
      "description": "IANA time zone database name (e.g. 'Europe/Istanbul'), never a raw UTC offset -- the offset itself can change with DST. 'UTC' is accepted as the one special-case bare identifier without a '/' (a genuinely valid zoneinfo name, and the honest fallback when no more specific zone could be resolved)."
    },
    "kind": {
      "type": "string",
      "enum": ["forecast", "current_observation", "historical", "unavailable"]
    },
    "units": {
      "type": "object",
      "properties": {
        "temperature": { "type": "string", "enum": ["C", "F"] },
        "wind_speed": { "type": "string", "enum": ["kmh", "mph", "ms"] },
        "precipitation": { "type": "string", "enum": ["mm", "in"] }
      },
      "required": ["temperature", "wind_speed", "precipitation"],
      "additionalProperties": false
    },
    "issued_at": {
      "type": "string",
      "format": "date-time",
      "description": "The provider's own forecast/observation issue time -- distinct from the envelope's retrieved_at (when we fetched it). Absent when kind='unavailable'."
    },
    "observation": {
      "type": "object",
      "description": "Present only when kind='current_observation'.",
      "properties": {
        "observed_at": { "type": "string", "format": "date-time" },
        "condition": { "type": "string", "minLength": 1 },
        "temperature": { "type": "number" },
        "precipitation_probability": { "type": "number", "minimum": 0, "maximum": 1 },
        "precipitation_amount": { "type": "number", "minimum": 0 },
        "wind_speed": { "type": "number", "minimum": 0 },
        "wind_direction_degrees": { "type": "number", "minimum": 0, "maximum": 360 }
      },
      "required": ["observed_at", "condition", "temperature"],
      "additionalProperties": false
    },
    "forecast_days": {
      "type": "array",
      "description": "Present for kind='forecast' or kind='historical'; empty for 'current_observation'/'unavailable'.",
      "items": {
        "type": "object",
        "properties": {
          "date": { "type": "string", "format": "date" },
          "condition": { "type": "string", "minLength": 1 },
          "high": { "type": "number" },
          "low": { "type": "number" },
          "precipitation_chance": { "type": "number", "minimum": 0, "maximum": 1 },
          "precipitation_amount": { "type": "number", "minimum": 0 },
          "wind_speed": { "type": "number", "minimum": 0 }
        },
        "required": ["date", "condition", "high", "low"],
        "additionalProperties": false
      }
    },
    "missing_fields": {
      "type": "array",
      "description": "Explicitly names any field a caller might expect but this response could not populate -- never silently omitted without a reason recorded here.",
      "items": { "type": "string", "minLength": 1 }
    }
  },
  "required": ["schema_version", "location", "timezone", "kind", "units", "missing_fields"],
  "additionalProperties": false
}
